{
  "schema_version": "1.0",
  "generated_at": "2026-08-31T12:00:00Z",
  "mode": "enforce",
  "outcome": "pending_cleanup",
  "state": "pending_cleanup",
  "head_sha": "aaaaaaaaaaaaaaaaaaaaaaaaaaaaaaaaaaaaaaaa",
  "tablespace": "nhms_cold",
  "container": "nhms-db",
  "identity": {
    "kind": "production",
    "container_name": "nhms-db",
    "prior_container_name": "nhms-db-before",
    "host_path": "/data/GHDC/nhms-cold-tablespace",
    "container_path": "/home/postgres/pgdata/tablespaces/nhms_cold",
    "tablespace": "nhms_cold",
    "docker_bin": "/usr/bin/docker",
    "host_port": 55432,
    "work_root": null,
    "image_id": null,
    "image_ref": null
  },
  "path": {
    "host_path": "/data/GHDC/nhms-cold-tablespace",
    "container_path": "/home/postgres/pgdata/tablespaces/nhms_cold",
    "exists": true,
    "device_identity": "8:11:1",
    "owner_uid": 999,
    "owner_gid": 999,
    "mode": 448,
    "empty": true
  },
  "container_snapshot": {
    "config_digest": "bbbbbbbbbbbbbbbbbbbbbbbbbbbbbbbbbbbbbbbbbbbbbbbbbbbbbbbbbbbbbbbb",
    "resolved_image_id": "sha256:ad39c4fbc5c44557db1e16af10ec11e3ab12d0a472374f39aaba06ad9ca2640e",
    "environment_names": ["PGDATA", "POSTGRES_PASSWORD", "POSTGRES_USER"]
  },
  "evidence": {
    "health": {"healthy": true},
    "backup": {"complete": true},
    "capacity": {"approved": true}
  },
  "readback": {
    "approved": false,
    "catalog_location": null,
    "pg_tblspc_target": null,
    "container_bind": null,
    "device_identity": null,
    "container_writable": null,
    "hypertable_attached": false,
    "new_chunk_tablespace": null
  },
  "ownership": {
    "prior_container": "nhms-db-before",
    "installer_container_created": false,
    "catalog_created": false,
    "host_path_created": true,
    "recovery_authority": true
  },
  "authority": {
    "state": "pending_cleanup",
    "phase": "terminal_pending_cleanup",
    "path_present": true
  },
  "rollback": {
    "attempted": true,
    "prior_restored": true,
    "host_path_removed": false,
    "blockers": ["host path removal boundary is unavailable"]
  },
  "blockers": ["host path removal boundary is unavailable"],
  "error": null
}
